word,pos,meaning,english,chinese
resume,n.,履歷,Please send your resume to us.,請將你的履歷寄給我們。
resume,v.,重新開始,We will resume work after lunch.,我們午餐後將恢復工作。
right,adj.,正確的,You are right.,你是對的。
right,adj.,右邊的,My right foot hurts.,我的右腳痛。
right,adv.,恰好/直接,He sat right next to me.,他就坐在我旁邊。
right,n.,權利,Everyone has rights.,每個人都有權利。
ring,n.,戒指,She wore a gold ring.,她戴著金戒指。
ring,n.,鈴聲,I heard a ring at the door.,我聽到門鈴聲。
ring,v.,打電話,I'll ring you tomorrow.,我明天打給你。
ring,v.,環繞,Fog rings the mountain.,霧環繞著山。
rock,n.,岩石,The road is blocked by rocks.,路被岩石擋住了。
rock,n.,搖滾樂,He loves rock music.,他喜歡搖滾樂。
rock,v.,搖動,She rocked the baby to sleep.,她搖晃寶寶入睡。
round,adj.,圓形的,The table is round.,這張桌子是圓的。
round,n.,一輪/回合,We won the first round of the game.,我們贏了比賽的第一回合。
round,n.,(社交) 一輪飲料,It’s my round to buy drinks.,這一輪飲料該我請客了。
round,n.,(子彈) 一發/一輪,He fired several rounds into the air.,他向空中開了幾槍（幾發子彈）。
round,prep.,圍繞/環繞,They sat round the fire.,他們圍著火堆坐著。
round,v.,繞過/轉過,The car rounded the corner.,汽車轉過轉角。
round,v.,四捨五入 (常用 round up/down),Round 4.8 up to 5.,將 4.8 四捨五入到 5。
ruler,n.,統治者,The king was a wise ruler.,國王是位英明的統治者。
ruler,n.,尺子,Measure the line with a ruler.,用尺子測量這條線。
run,n.,一段期間/系列,The play had a long run.,這齣戲連演了很久。
run,n.,趨勢/走向,the run of events,事件的發展趨勢。
run,v.,跑步,I run every morning.,我每天早上跑步。
run,v.,經營,She runs a small shop.,她經營一家小店。
safe,adj.,安全的,Is it safe to swim here?,在這裡游泳安全嗎？
safe,n.,保險箱,Keep your valuables in the safe.,把你的貴重物品放在保險箱裡。
saw,n.,鋸子,He cut the wood with a saw.,他用鋸子鋸木頭。
saw,v.,鋸開,He sawed the log in half.,他把木頭鋸成兩半。
saw,v.,see的過去式,I saw a movie yesterday.,我昨天看了一部電影。
scale,n.,規模,The damage was on a large scale.,損害規模很大。
scale,n.,刻度,The scale on the map is 1:1000.,地圖上的比例尺是1:1000。
scale,n.,魚鱗,The fish has shiny scales.,這條魚有發亮的鱗片。
scale,v.,攀登,He scaled the wall.,他爬上了牆。
seal,n.,海豹,The seal swam in the ocean.,海豹在海裡游泳。
seal,n.,印章/封條,He put a wax seal on the letter.,他在信上蓋了蠟封。
seal,v.,封閉,Seal the envelope.,封上信封。
seal,v.,確定/保證,The victory sealed their championship.,這場勝利確定了他們的冠軍。
season,n.,季節,Summer is my favorite season.,夏天是我最喜歡的季節。
season,v.,調味,Season the soup with salt.,用鹽給湯調味。
season,v.,使適應,He is a seasoned traveler.,他是位經驗豐富的旅行者。
seat,n.,座位,Please take a seat.,請坐。
seat,v.,可容納,The hall seats 500 people.,這個大廳可容納500人。
seat,v.,使就座,He seated himself near the window.,他在窗邊坐下。
secure,adj.,安全的,The building is secure.,這棟建築很安全。
secure,v.,獲得,He secured a loan.,他獲得了一筆貸款。
secure,v.,繫牢,Secure the rope.,把繩子繫牢。
sentence,n.,句子,Write a sentence.,寫一個句子。
sentence,n.,刑期,He served a five-year sentence.,他服了五年刑期。
sentence,v.,判刑,The judge sentenced him to prison.,法官判他入獄。
serve,v.,服務,She serves customers.,她服務顧客。
serve,v.,供應（食物）,Breakfast is served from 7 AM.,早餐從早上七點開始供應。
serve,v.,擔任,He served as manager.,他擔任經理。
serve,v.,服刑,He served five years in prison.,他在監獄服刑五年。
serve,v.,發球（網球）,It's your turn to serve.,輪到你發球了。
set,n.,一套,a set of tools,一套工具。
set,n.,場景（戲劇/電影）,The movie was filmed on a set.,這部電影在片場拍攝。
set,v.,放置,Set the cup on the table.,把杯子放在桌上。
set,v.,設定,Set the alarm for 7 AM.,把鬧鐘設在早上七點。
set,v.,凝固,The concrete set overnight.,混凝土一夜之間凝固了。
shoulder,n.,肩膀,He carried a bag on his shoulder.,他肩上背了一個袋子。
shoulder,v.,承擔,She shouldered the responsibility.,她承擔了責任。
shoulder,v.,用肩膀推擠,He shouldered his way through.,他用肩膀擠了過去。
sign,n.,跡象/標誌,There is no sign of life.,沒有生命的跡象。
sign,v.,簽名/簽署,Please sign your name here.,請在這裡簽名。
sink,n.,水槽,Wash your hands in the sink.,在水槽裡洗手。
sink,v.,下沉,The ship sank.,船沉了。
sink,v.,下降,His spirits sank.,他的情緒低落。
sink,v.,投入資金,He sank all his money into the business.,他把所有錢都投入了生意。
skip,n.,跳躍,He gave a little skip.,他輕輕一跳。
skip,v.,跳過,She skipped over the details.,她跳過了細節。
skip,v.,跳繩,The children are skipping.,孩子們在跳繩。
skip,v.,不參加,He skipped class.,他翹課了。
solution,n.,解決方法,We need a solution to the problem.,我們需要一個解決問題的方法。
solution,n.,溶液,The salt dissolves in the solution.,鹽溶解在溶液中。
sophisticated,adj.,精密的,sophisticated technology,精密的技術
sophisticated,adj.,世故的,She is sophisticated for her age.,以她的年齡來說她很世故。
sound,adj.,健康的/堅固的,He has a sound mind.,他心智健全。
sound,n.,聲音,I heard a strange sound.,我聽到一個奇怪的聲音。
sound,v.,聽起來,That sounds good.,那聽起來不錯。
sound,v.,測量深度,Sound the ocean floor.,測量海底深度。
spade,n.,黑桃 (撲克牌),The Ace of spades is the highest card.,黑桃 A 是最大的牌。
spade,n.,鏟子/鍬,He used a spade to dig a hole.,他用鏟子挖了一個洞。
spend,v.,花費 (金錢/時間),I spent $50 on this book.,我花了 50 美元買這本書。
spend,v.,消耗/用盡,The force of the storm was spent.,風暴的力量已經耗盡。
spring,n.,春天,I love the flowers in spring.,我喜歡春天的花朵。
spring,n.,彈簧,The spring is broken.,這個彈簧壞了。
spring,n.,泉水,This is a hot spring.,這是個溫泉。
spring,v.,跳躍,The cat sprang onto the table.,貓跳上了桌子。
square,adj.,公正的/直角的,We need a square deal.,我們需要一場公平的交易。
square,n.,正方形,A square has four equal sides.,正方形有四條相等的邊。
square,n.,廣場,Let's meet at the town square.,我們在城鎮廣場見面吧。
square,v.,平方/結清,Four squared is sixteen.,4 的平方是 16。
stable,adj.,穩定的,The patient is in stable condition.,病人情況穩定。
stable,n.,馬廄,The horses are in the stable.,馬在馬廄裡。
stable,v.,把…關進馬廄,They stable their horses there.,他們把馬養在那裡。
staff,n.,全體員工,The staff are very helpful.,員工們非常樂於助人。
staff,n.,棍棒/拐杖,He leaned on his staff.,他倚靠著拐杖。
staff,v.,配備員工,The office is staffed by 10 people.,辦公室配備了10名員工。
stand,n.,攤位,a hot dog stand,一個熱狗攤。
stand,n.,立場,take a stand on an issue,在某議題上表明立場。
stand,v.,站立,Stand by the door.,站在門邊。
stand,v.,忍受,I can't stand the noise.,我無法忍受噪音。
stand,v.,處於某種狀態,He stands accused of lying.,他被指責說謊。
staple,adj.,主要的/基本的,This is a staple feature of the app.,這是該應用程式的主要功能。
staple,n.,訂書釘,Put a staple in these papers.,在這些文件上打個訂書釘。
staple,n.,主食/主要產品,Rice is a staple food in Asia.,稻米是亞洲的主食。
state,n.,州,Texas is a big state.,德州是個大州。
state,n.,狀態,Water in a liquid state.,液態的水。
state,v.,陳述,He stated his opinion.,他陳述了自己的意見。
stem,n.,莖,The rose has a long stem.,這朵玫瑰的莖很長。
stem,v.,起源,The problem stems from a mistake.,問題源於一個錯誤。
stem,v.,阻止,We must stem the tide of fake news.,我們必須阻止假新聞蔓延。
still,adj.,靜止的,The water was still.,水面平靜無波。
still,adv.,仍然,He is still sleeping.,他還在睡覺。
still,conj.,然而,"It's raining; still,I'll go.  ",下雨了，然而我還是會去。
still,n.,靜止照片,stills from a movie,電影的靜止畫面。
stock,n.,股票/股份,The company's stock price rose.,該公司的股價上漲了。
stock,n.,庫存/存貨,We have the item in stock.,我們這件物品有現貨（庫存）。
stock,n.,高湯,Beef stock is used for the soup.,牛肉高湯用來煮湯。
stop,n.,車站,Get off at the next stop.,在下一站下車。
stop,n.,逗留/停留,We made a brief stop in Paris.,我們在巴黎短暫停留。
stop,n.,塞子/阻礙物,Put a stop in the bottle.,給瓶子塞上塞子。
stop,n.,(風琴的) 音栓/音調,He pulled out all the stops.,他使出了渾身解數（原指拉開風琴所有音栓）。
stop,v.,停止/結束,Please stop talking.,請停止說話。
stop,v.,阻擋/攔截,The goalkeeper stopped the ball.,守門員擋住了球。
store,n.,商店,I went to the store.,我去了商店。
store,n.,儲備量,a store of knowledge,知識的儲備。
store,v.,儲存,We store food for winter.,我們儲存食物過冬。
strain,n.,拉傷/壓力,The job is putting a strain on him.,這份工作給他帶來很大壓力。
strain,n.,(病毒) 株/變種,Doctors found a new strain of the virus.,醫生發現了一種新的病毒株。
strain,v.,過濾,Strain the pasta and serve.,將義大利麵過濾掉水後端上桌。
strike,n.,罷工,a nationwide strike,全國性罷工。
strike,n.,打擊（軍事）,an air strike,空襲。
strike,v.,打擊,He struck the table with his fist.,他用拳頭打桌子。
strike,v.,突然想到,An idea struck me.,我突然想到一個主意。
strike,v.,罷工,The workers are striking for higher pay.,工人為加薪而罷工。
subject,adj.,易受...影響的,The flight is subject to delay.,航班可能會延誤。
subject,n.,主題/學科,Math is my favorite subject.,數學是我最喜歡的學科。
subject,v.,使服從/遭受,He was subjected to criticism.,他遭受了批評。
suit,n.,西裝/套裝,He wore a dark suit to the interview.,他穿著深色西裝去面試。
suit,n.,訴訟/法律案件,They filed a law suit against the company.,他們對該公司提起了法律訴訟。
suit,v.,適合/中意,Does this time suit you?,這個時間對你方便（適合）嗎？
summit,n.,山頂/頂峰,We reached the summit at noon.,我們在中午抵達了山頂。
summit,n.,峰會/高層會議,The leaders attended the G20 summit.,各國領導人參加了 G20 峰會。
table,n.,桌子/表格,Please look at the table on page 5.,請看第 5 頁的表格。
table,v.,提交討論 (英),They tabled a new proposal.,他們提交了一項新提案。
table,v.,擱置 (美),The motion was tabled for now.,該動議目前被擱置了。
tap,n.,水龍頭,Turn off the tap.,關掉水龍頭。
tap,n.,輕拍,a gentle tap on the door,輕輕敲門。
tap,v.,輕拍,He tapped me on the shoulder.,他輕拍我的肩膀。
tap,v.,開發/利用,We need to tap new resources.,我們需要開發新資源。
tap,v.,竊聽,The phone was tapped.,電話被竊聽了。
temple,n.,寺廟,There is an ancient temple on the hill.,山上有一座古老的寺廟。
temple,n.,太陽穴,He rubbed his temples because of the headache.,他因為頭痛揉了揉太陽穴。
tender,adj.,溫柔的,She gave him a tender look.,她溫柔地看了他一眼。
tender,adj.,嫩的,The meat is tender.,這肉很嫩。
tender,n.,交通工具（駁船/補給車）,a tank tender,油罐補給車。
tender,v.,提出（正式）,He tendered his resignation.,他提出了辭呈。
thumb,n.,大拇指,He sucked his thumb.,他吸吮大拇指。
thumb,v.,翹起拇指搭便車,He thumbed a ride to the city.,他豎起拇指搭便車進城。
thumb,v.,翻閱（書頁）,She thumbed through the magazine.,她翻閱雜誌。
tip,n.,尖端/頂端,The tip of the iceberg.,冰山一角。
tip,n.,小費,He left a generous tip.,他留下了豐厚的小費。
tip,n.,秘訣/提示,Here's a useful tip for you.,給你一個實用的建議。
tip,v.,傾倒/翻倒,The boat tipped over.,船翻了。
train,n.,火車,The train is late.,火車誤點了。
train,v.,訓練,They train dogs for rescue.,他們訓練狗進行救援。
treat,n.,樂事/款待,It's a treat to see you.,見到你真開心。
treat,v.,對待,She treats me kindly.,她對我很好。
treat,v.,治療,The doctor treated my wound.,醫生治療我的傷口。
treat,v.,款待,I'll treat you to dinner.,我請你吃晚餐。
trip,n.,旅行,We went on a business trip.,我們去出差（商務旅行）。
trip,v.,絆倒,He tripped over a wire.,他被電線絆倒了。
trip,v.,觸發/觸動 (開關或警報),Someone tripped the silent alarm.,有人觸發了靜默警報。
watch,n.,手錶,My watch is fast.,我的手錶快了。
watch,v.,看,Do you watch TV?,你看電視嗎？
watch,v.,注意,Watch your step.,注意腳步。
water,n.,水,Drink plenty of water.,喝充足的水。
water,v.,給...澆水,Don't forget to water the plants.,別忘了給植物澆水。
water,v.,流口水/流淚,The smell made my mouth water.,那香味讓我流口水。
wave,n.,波浪,The waves crashed on the shore.,波浪拍打海岸。
wave,n.,浪潮（趨勢）,a wave of protest,一波抗議浪潮。
wave,v.,揮手,He waved goodbye.,他揮手告別。
wave,v.,起伏,The flag waved in the wind.,旗子在風中飄揚。
weather,n.,天氣,The weather is beautiful today.,今天天氣很好。
weather,v.,度過/經受住,The company weathered the crisis.,公司挺過了這次危機。
well,adj.,健康的,I don't feel well.,我覺得不舒服。
well,adv.,好地,She sings well.,她唱得很好。
well,inter.,嗯（感嘆詞）,"Well,let's start.",嗯，我們開始吧。
well,n.,水井,The village has an old well.,村裡有一口古井。
wrist,n.,手腕,She wore a bracelet on her wrist.,她手腕上戴了手鐲。
wrist,v.,用手腕揮動,He wristed the ball into the net.,他用手腕把球甩進網中。
yield,n.,產量/收益,The crop yield was lower this year.,今年的農作物產量較低。
yield,v.,產生/產出,This investment yields high returns.,這項投資產生了高回報。
yield,v.,屈服/讓路,He yielded to the pressure.,他屈服於壓力。
handle,n.,把手/柄,The door handle is broken.,門把壞了。
handle,v.,處理/應付,She knows how to handle pressure.,她知道如何應付壓力。
handle,v.,觸摸/拿取,Please handle with care.,請小心拿取（易碎品）。
room,n.,房間,There are three rooms in the house.,這房子有三個房間。
room,n.,空間/餘地 (不可數),Is there any room for improvement?,還有進步的空間（餘地）嗎？
might,auxi.,可能 (may 的過去式),It might rain tonight.,今晚可能會下雨。
might,n.,力量/威力,They fought with all their might.,他們竭盡全力（力量）戰鬥。
hide,v.,躲藏/隱藏,They hid the treasure in a cave.,他們把寶藏藏在山洞裡。
hide,n.,獸皮/皮革,The drums are made of animal hides.,這些鼓是用動物皮革製成的。
hit,v.,打擊/碰撞,The car hit a tree.,汽車撞上了一棵樹。
hit,n.,成功/紅極一時的人事物,Her new song is a big hit.,她的新歌非常受歡迎（大紅大紫）。
hit,v.,突然意識到,It suddenly hit me that I was late.,我突然意識到我遲到了。
own,adj.,自己的,I saw it with my own eyes.,我親眼所見。
own,v.,擁有,Who owns this house?,誰擁有這棟房子？
own,v.,承認 (own up to),He owned his mistakes.,他承認了他的錯誤。
goal,n.,目標/目的,My goal is to study abroad.,我的目標是出國留學。
goal,n.,進球/球門,He scored a amazing goal.,他踢進了一個精彩的球。
knock,v.,敲/擊,Someone is knocking at the door.,有人在敲門。
knock,n.,敲擊聲,I heard a knock on the window.,我聽到窗戶傳來敲擊聲。
knock,v.,批評 (口語),Don't knock it until you try it.,沒試過以前不要批評它。
lack,n.,缺乏/不足,The project failed for lack of funds.,該計畫因缺乏資金而失敗。
lack,v.,缺少,He lacks the confidence to lead.,他缺少領導的自信。
lay,v.,放置/產卵,Please lay the book on the table.,請把書放在桌上。
lay,adj.,外行的/非專業的,"In lay terms, it means...",用外行人的話來說（通俗來說），這意味著...
lift,v.,舉起/抬起,Can you lift this heavy box?,你能搬起這個重箱子嗎？
lift,n.,電梯 (英式),We took the lift to the 10th floor.,我們搭電梯到 10 樓。
lift,n.,搭便車,Can you give me a lift to the station?,你能載我一程去車站嗎？
limit,n.,限制/界限,There is a speed limit here.,這裡有速度限制。
limit,v.,限制/限定,We must limit our spending.,我們必須限制開支。
rule,n.,規則/規定,You must follow the rules.,你必須遵守規則。
rule,v.,統治/裁決,King Victoria ruled for 63 years.,維多利亞女王統治了 63 年。
rule,n.,常規/習慣 (as a rule),"As a rule, I get up at six.",通常情況下，我六點起床。
make,v.,製造/做,I made a cake for his birthday.,我為他的生日做了一個蛋糕。
make,n.,品牌/型號,What make is your car?,你的車是什麼牌子的？
make,v.,成為/適合,She will make a great doctor.,她會成為一名優秀的醫生。
master,n.,主人/大師,He is a master of martial arts.,他是一位武術大師。
master,v.,精通/掌握,She mastered the French language.,她精通了法語。
master,n.,碩士學位,He has a Master's degree.,他擁有碩士學位。
mind,n.,頭腦/理智,Keep an open mind.,保持開放的心態。
mind,v.,介意/在乎,Do you mind if I smoke?,你介意我抽菸嗎？
mind,v.,照顧/留神,Mind the gap between the train and platform.,請小心列車與月台間的空隙。
move,v.,移動/搬家,We are moving to a new office.,我們要搬到新辦公室。
move,v.,使感動,The movie deeply moved me.,這部電影深深打動了我。
move,n.,舉動/步驟,It's your move (in chess).,該你走了（下棋時）。
pass,v.,通過/經過,Did you pass the exam?,你考試通過了嗎？
pass,n.,通行證/門票,You need a mountain pass to enter.,你需要入山證才能進入。
pass,v.,傳遞,Please pass the salt.,請把鹽遞給我。
pass,n.,山隘/山口,The army moved through the mountain pass.,軍隊通過了山隘。
please,v.,請 (禮貌用語),Please sit down.,請坐。
please,v.,使高興/取悅,You can't please everyone.,你不可能取悅每一個人。
print,v.,印刷/列印,I'll print the document for you.,我會為你列印這份文件。
print,n.,指紋/足跡 (常用於複數),The police found fingerprints.,警察發現了指紋。
print,n.,印刷字體 (非草寫),Please write in block print.,請以正體（非草寫）書寫。
party,n.,派對/聚會,We had a great time at the party.,我們在派對上玩得很開心。
party,n.,政黨,He belongs to the Liberal Party.,他隸屬於自由黨。
party,n.,當事人/一方 (法律),Both parties signed the contract.,雙方（當事人）都簽署了合約。
puzzle,n.,謎題/拼圖,I love solving cross-word puzzles.,我喜歡玩填字遊戲（謎題）。
puzzle,v.,使困惑,The sudden change puzzled me.,突如其來的變化讓我感到困惑。
wonder,v.,想知道/納悶,I wonder why he is late.,我想知道他為什麼遲到。
wonder,n.,驚奇/奇觀,The Grand Canyon is a wonder of nature.,大峽谷是大自然的奇觀。
capture,v.,捕捉/捕獲,The police captured the thief.,警察抓住了小偷。
capture,v.,留住 (瞬間/美感),The photo captures her smile.,這張照片捕捉到了她的笑容。
close,v.,關閉,Close the door.,關門！
close,adj.,親近的/接近的,They are close friends.,他們是親密的朋友。
close,n.,結束/終結,The meeting came to a close.,會議結束了。
show,v.,展示/表現,Please show your passport. ,請出示你的護照。
show,n.,展覽/表演,Did you see the fashion show?,你看時裝秀了嗎？
show,n.,跡象 (常指病徵),There is no show of improvement.,沒有好轉的跡象。
trunk,n.,象鼻,The elephant used its trunk to eat.,大象用象鼻吃東西。
trunk,n.,樹幹,The trunk of this oak is very thick.,這棵橡樹的樹幹很粗。
trunk,n.,後車廂 (美),Put your bags in the trunk.,把你的行李放在後車廂。
pretty,adj.,漂亮的,The little girl is pretty.,小女孩很漂亮。
pretty,adv.,相當地/非常,I am pretty sure about it.,我對此相當確定。
stream,n.,溪流/小河,We jumped across the stream.,我們跳過了小溪。
stream,v.,流動/串流 (影音),Sunlight streamed through the window.,陽光從窗戶灑進來（流瀉）。
sparkle,v.,閃耀/發光,The diamonds sparkled in the light.,鑽石在光線下閃閃發光。
sparkle,n.,活力/閃光,Her eyes have a bright sparkle.,她的眼睛很有神采（閃爍）。
stick,n.,棍子/枝條,Use a stick to stir the fire.,用棍子撥火。
stick,v.,黏貼/固定,Stick the label on the box.,把標籤貼在箱子上。
stick,v.,堅持 (stick to),We must stick to the plan.,我們必須堅持計劃。
spear,n.,矛/魚叉,The hunter carried a spear.,獵人拿著一支矛。
spear,v.,刺/戳,He speared a piece of meat with a fork.,他用叉子叉起一塊肉。
fall,v.,落下/跌倒,He usually falls asleep in class. ,他經常在課上睡著。
fall,n.,秋天 (美),I love the colors in the fall.,我喜歡秋天的色彩。
fall,n.,瀑布 (常用複數 falls),We visited Niagara Falls.,我們參觀了尼加拉瀑布。
splash,v.,濺起/潑水,The kids were splashing in the pool.,孩子們在池子裡玩水。
splash,n.,亮點/引人注目的事物,Her dress added a splash of color.,她的裙子增添了一抹亮色。
burst,v.,爆炸/破裂,The balloon burst.,氣球破了。
burst,n.,突然爆發,A burst of applause followed the speech.,演講後響起了一陣掌聲。
share,v.,分享,I have a secret to share with you.,我跟你分享一個秘密。
share,n.,股份/一份,He sold all his shares in the company.,他賣掉了公司的所有股份。
turn,v.,轉動/變成,His face turned red.,他的臉紅了。
turn,n.,輪到的機會,It's your turn to wash the dishes.,輪到你洗碗了。
family,n.,家庭/家人,There are five people in my family. ,我家有五口人。
family,n.,(生物分類) 科,Lions belong to the cat family.,獅子屬於貓科。
school,n.,學校,I go to school by train. ,我坐火車上學。
school,n.,魚群 (a school of fish),Look at that school of dolphins.,看那一群海豚。
school,n.,學派/流派,He belongs to a different school of thought.,他屬於不同的思想學派。
experience,n.,經驗/經歷 (不可數/可數),I have ten years of experience.,我有十年的經驗。
experience,v.,體驗/遭受,The country is experiencing a crisis.,該國正經歷一場危機。
study,v.,學習/研究,He is studying.,他在學習。
study,n.,研究報告/調查,A recent study shows that...,最近的一項研究顯示...
study,n.,書房,He is reading in his study.,他正在書房裡看書。
paper,n.,紙張,Write your name on the paper.,在紙上寫下你的名字。
paper,n.,論文/報告,He published a paper on physics.,他發表了一篇關於物理的論文。
paper,n.,報紙,Did you read today's paper?,你讀了今天的報紙嗎？
paper,v.,貼壁紙,We decided to paper the bedroom.,我們決定給臥室貼上壁紙。
shelter,n.,避難所/遮蔽處,They found shelter from the rain.,他們找到了避雨的地方。
shelter,v.,庇護/掩護,The trees sheltered us from the sun.,樹木為我們遮擋了陽光。
can,auxiliary,能夠/可以,Can you help me?,你可以幫我一下嗎？
can,n.,罐頭/金屬罐,Open a can of soup.,打開一罐湯。
can,v.,將...裝罐,They can peaches in the factory.,他們在工廠裡把桃子裝成罐頭。
can,v.,解僱 (美式俚語),He got canned for his poor work.,他因為工作表現差被開除了。
cause,n.,原因/起因,What was the cause of the fire?,火災的原因是什麼？
cause,v.,導致/引起,The storm caused a lot of damage.,這場風暴造成了很大的損害。
cause,n.,理想/事業/訴求,They are fighting for a noble cause.,他們正在為一個高尚的理想而奮鬥。
document,n.,文件/公文,Please sign this document.,請在這份文件上簽名。
document,v.,記錄/記載,We need to document the entire process.,我們需要記錄整個過程。
guide,n.,指南/導遊,Read the user guide carefully.,仔細閱讀使用者指南。
guide,v.,引導/指導,The stars guided the sailors.,星星引導著水手們。
attempt,v.,嘗試/企圖,He attempted to break the record.,他嘗試打破紀錄。
attempt,n.,嘗試/努力,This was his first attempt at cooking.,這是他第一次嘗試下廚。
pack,v.,打包/裝箱,I need to pack my suitcase.,我需要收拾我的行李箱。
pack,n.,(動物) 一群/一包,A pack of wolves was howling.,一群狼正在嚎叫。
pack,v.,擠滿/塞滿,Fans packed the stadium.,歌迷們擠滿了體育場。
apply,v.,申請,I want to apply for this job.,我想申請這份工作。
apply,v.,應用/適用,The rule does not apply here.,這項規則在這裡不適用。
apply,v.,塗抹/敷,Apply the cream to the wound.,將藥膏塗抹在傷口上。
