word,pos,meaning,english,chinese
application,n.,申請(書),Send in your application by Friday.,週五前遞交你的申請。
application,n.,應用/用途,The technology has many applications.,這項技術有許多用途。
application,n.,應用程式 (App),Download the mobile application.,下載行動應用程式。
factor,n.,因素/要素,Price is a key factor in the decision.,價格是決策的關鍵因素。
factor,n.,因數 (數學),3 is a factor of 15.,3 是 15 的因數。
factor,v.,把...納入考慮 (factor in),Remember to factor in the cost of shipping.,記得要把運費納入考慮。
manage,v.,管理/經營,He manages a team of ten people.,他管理一個十人的團隊。
manage,v.,設法做到/應付,I managed to finish the work on time.,我設法準時完成了工作。
overall,adj.,全部的/整體的,The overall cost was $100.,總成本（整體費用）是 100 美元。
overall,n.,工作服/連身褲,He wore blue overalls.,他穿著藍色工作服。
place,n.,地方/地點,I need a quiet place. ,我需要一個安靜的地方。
place,v.,放置/安置,She placed the vase on the table.,她把花瓶放在桌上。
place,v.,名次/排名,He placed second in the race.,他在比賽中獲得第二名。
area,n.,地區/區域,I know the local area very well. ,我對當地很了解。
area,n.,面積,What is the area of the square?,這個正方形的面積是多少？
area,n.,領域/範圍,Physics is not my area of expertise.,物理不是我的專業領域。
high,adj.,高的,She likes to wear high heels. ,她喜歡穿高跟鞋。
high,n.,最高點/紀錄,Prices reached a new high.,價格達到了新高。
work,v.,工作,My brother works in a factory. ,我哥哥在一家工廠工作。
work,v.,運作；運行,The medicine doesn't work well. ,這種藥不太有效果。
work,n.,作品/著作,This is a famous work of art.,這是一件著名的藝術作品。
fold,v.,折疊,Fold the paper in half.,把紙對折。
fold,n.,摺痕,There was a fold in the map.,地圖上有個摺痕。
fold,n.,羊圈/圈子 (歸隊),He returned to the family fold.,他回到了家族的圈子（歸隊）。
tail,n.,尾巴,The dog is waggling its tail. ,夠搖著尾巴。
tail,v.,尾隨/跟蹤,The detective tailed the suspect.,偵探尾隨了嫌疑犯。
tail,n.,(硬幣的) 背面,Heads or tails?,正面還是反面？
field,n.,田地/原野,The students will go on a field trip next week. ,學生下週有校外教學。
field,n.,領域/學科,He is an expert in the field of AI.,他是 AI 領域的專家。
field,v.,處理/應付 (問題/球),She fielded some tough questions.,她應付了一些棘手的問題。
major,adj.,主要的/重大的,A major change is coming.,一場重大的變革即將到來。
major,n.,主修/專業,My major is Economics.,我的主修（專業）是經濟學。
major,v.,主修 (major in),I majored in History at college.,我在大學主修歷史。
majority,n.,多數/過半數,The majority of people agreed.,大多數人都同意。
majority,n.,法定成年,He has reached his majority.,他已經成年了（達到法定年齡）。
minor,adj.,次要的/輕微的,It was just a minor mistake.,那只是一個輕微的錯誤。
minor,n.,輔修學位,She has a minor in Psychology.,她輔修心理學。
minor,n.,未成年人,Minors are not allowed to drink.,未成年人禁止飲酒。
minority,n.,少數/少數族群,They are a small minority.,他們是少數群體。
extreme,adj.,極端的/極度的,The weather was extreme.,天氣非常極端。
extreme,n.,極端/兩極,Love and hate are two extremes.,愛與恨是兩個極端。
position,n.,位置/姿勢,We can see the whole city from this position. ,從這個位置可以看到整個城市。
position,n.,職位/地位,He holds a high position in the firm.,他在公司擔任高職。
position,n.,立場/態度,What is your position on this issue?,你對這個問題的立場是什麼？
stamp,n.,郵票,This is a rare stamp.,這張郵票很稀有。
stamp,v.,蓋章/戳印,They stamped my passport.,他們在我的護照上蓋了章。
stamp,v.,跺腳,She stamped her foot in anger.,她憤怒地跺腳。
stamp,n.,標記/特徵,The design bears the stamp of genius.,這個設計帶有天才的印記（特徵）。