word,pos,meaning,english,chinese
foundation,n.,基金會,She works for a charity foundation.,她為一個慈善基金會工作。
function,n.,功能,The function of the heart is to pump blood.,心臟的功能是泵血。
function,n.,函數,This is a mathematical function.,這是一個數學函數。
function,v.,運作,The machine functions well.,這台機器運作良好。
generate,v.,產生,generate electricity,發電
generate,v.,引起,The news generated excitement.,這則新聞引起了興奮。
genuine,adj.,真誠的,She showed genuine concern.,她表現出真誠的關心。
genuine,adj.,真的,This is a genuine diamond.,這是一顆真鑽石。
go,n.,嘗試 (have a go),Let me have a go at it.,讓我來試試看。
go,v.,去/前往,Where are you going?,你要去哪裡？
go,v.,運行/進展,How's the project going?,專案進展如何？
go,v.,變成 (通常指變壞),The milk has gone sour.,牛奶變酸了。
grace,n.,優雅,She danced with grace.,她跳舞很優雅。
grace,n.,寬限期,The payment has a three-day grace period.,付款有三天的寬限期。
grace,v.,使增添光彩,The queen graced the event with her presence.,女王親臨使活動增光。
grant,n.,補助金,He received a research grant.,他獲得了一筆研究補助金。
grant,v.,授予,The school granted him a scholarship.,學校授予他獎學金。
grant,v.,承認,I grant that you are right.,我承認你是對的。
grave,adj.,嚴重的,This is a grave mistake.,這是一個嚴重的錯誤。
grave,adj.,莊嚴的,His face was grave.,他的表情莊嚴。
grave,n.,墳墓,He visited his mother's grave.,他去掃母親的墓。
gross,adj.,總共的/毛額的,"The gross income is $50,000.",總收入（毛利）是 5 萬美元。
gross,adj.,噁心的/粗魯的,That smell is really gross.,那味道真的很噁心。
ground,n.,地面,The ball hit the ground.,球擊中地面。
ground,n.,理由/根據,He retired on medical grounds.,他以健康理由退休。
ground,v.,使停飛,The plane was grounded.,飛機被停飛。
ground,v.,以……為基礎,His argument is grounded on facts.,他的論點以事實為基礎。
guarantee,n.,保證,The product comes with a guarantee.,這個產品有保證。
guarantee,v.,保證,I guarantee you will like it.,我保證你會喜歡。
hail,n.,冰雹,Hail damaged the crops.,冰雹損壞了作物。
hail,v.,歡呼,The crowd hailed the hero.,群眾向英雄歡呼。
hail,v.,下冰雹,It's hailing outside.,外面在下冰雹。
hail,v.,招呼,She hailed a taxi.,她招手叫了一輛計程車。
hand,n.,手,She raised her hand.,她舉起了手。
hand,n.,指針（時鐘）,The hour hand is slow.,時針慢了。
hand,n.,協助,He gave me a hand.,他幫了我一把。
hand,v.,遞交,Please hand me the book.,請把書遞給我。
hang,n.,訣竅 (get the hang of),You will soon get the hang of it.,你很快就會掌握其中的訣竅。
hang,v.,懸掛 (hang-hung-hung),Hang your coat on the hook.,把你的外套掛在掛鉤上。
hang,v.,絞刑 (hang-hanged-hanged),He was hanged for his crimes.,他因犯罪而被處以絞刑。
hang,v.,暫時無法決定/停滯,The decision is still hanging.,決定仍處於懸而未決的狀態。
harbor,n.,港口,The ship left the harbor.,船離開了港口。
harbor,v.,懷有（想法）,He harbors a grudge.,他心懷怨恨。
harbor,v.,窩藏,It is illegal to harbor a fugitive.,窩藏逃犯是違法的。
hard,adj.,困難的,This test is hard.,這次考試很難。
hard,adj.,硬的,The ground is hard.,地面很硬。
hard,adv.,努力地,Work hard!,努力工作！
hazard,n.,危險,Smoking is a health hazard.,吸煙對健康有害。
hazard,v.,冒險猜測,She hazarded a guess.,她大膽猜測了一下。
head,adj.,首要的,the head office,總公司。
head,n.,頭部,He nodded his head.,他點了點頭。
head,v.,帶領,She heads the department.,她領導這個部門。
head,v.,朝…方向前進,We are heading home.,我們正朝家前進。
heart,n.,心臟/內心,Exercise is good for your heart.,運動對心臟有好處。
heart,n.,紅心 (撲克牌),The Queen of hearts is missing.,紅心 Q 不見了。
heart,n.,核心/中心,We live in the heart of the city.,我們住在市中心。
heel,n.,腳後跟,My heel hurts.,我的腳後跟痛。
heel,n.,卑鄙小人（俚語）,You heel!,你這個混蛋！
heel,v.,緊跟（狗指令）,Heel! the owner commanded.,「跟上！」主人命令道。
hold,n.,抓握,Keep a tight hold on the rope.,緊緊抓住繩子。
hold,v.,握住,She held my hand.,她握住我的手。
hold,v.,舉辦,The city will hold a festival.,這個城市將舉辦一個節日。
hold,v.,容納,The room holds 50 people.,這個房間可容納50人。
hold,v.,持有（觀點）,I hold that view.,我持那種觀點。
host,n.,主人,The host welcomed the guests.,主人歡迎客人。
host,n.,寄主/宿主,The virus infects its host.,病毒感染其宿主。
host,v.,主辦,Tokyo hosted the Olympics.,東京主辦了奧運會。
house,n.,房子,They bought a new house.,他們買了一間新房子。
house,n.,機構/議院,the White House / the House of Commons,白宮 / 下議院
house,v.,提供住處,The building houses 200 families.,這棟建築給200個家庭提供住處。
house,v.,收藏/容納,The museum houses famous paintings.,這座博物館收藏著名畫作。
ignore,v.,忽視,He ignored my advice.,他忽視了我的建議。
ignore,v.,不顧,The driver ignored the red light.,司機不顧紅燈。
illustrate,v.,說明,The example illustrates the point.,這個例子說明了這一點。
illustrate,v.,加插圖,She illustrated the book.,她為這本書畫了插圖。
imply,v.,暗示,His silence implied agreement.,他的沉默暗示同意。
imply,v.,意味著,Freedom does not imply license.,自由並不意味著放縱。
impose,v.,強加,Don't impose your ideas on me.,不要把你的想法強加給我。
impose,v.,徵稅,The government imposed a tax.,政府徵收了一項稅。
incline,n.,斜坡,a steep incline,一個陡峭的斜坡
incline,v.,傾向,I incline to agree with you.,我傾向於同意你。
incline,v.,傾斜,The road inclines upward.,這條路向上傾斜。
indifferent,adj.,漠不關心的,He is indifferent to criticism.,他對批評漠不關心。
indifferent,adj.,一般的,an indifferent performance,一場平平的表演
induce,v.,勸誘,Nothing could induce him to come.,沒有什麼能勸他來。
induce,v.,引起,The drug induces sleep.,這種藥引起睡意。
induce,v.,誘導,induce labor in childbirth,在分娩中引產
indulge,v.,沉溺,He indulges in junk food.,他沉溺於垃圾食品。
indulge,v.,縱容,She indulges her children.,她縱容她的孩子。
infer,v.,推斷,I inferred from his words that he was angry.,我從他的話推斷他生氣了。
infer,v.,暗示（少用）,Your statement infers that I am wrong.,你的陳述暗示我錯了。
inherent,adj.,內在的,The risks are inherent in the job.,風險是這份工作本身固有的。
inherent,adj.,天生的,an inherent talent,天生的才能
initial,adj.,最初的,My initial reaction was surprise.,我最初的反應是驚訝。
initial,n.,首字母,His initials are J.P.,他的姓名首字母是J.P.。
initial,v.,簽姓名的首字母,Please initial each page.,請在每一頁簽上姓名首字母。
inspect,v.,檢查,Inspect the car before buying.,買車前檢查一下。
inspect,v.,視察,The general inspected the troops.,將軍視察了部隊。
instance,n.,例子,"For instance,take this case.",例如，拿這個案例來說。
instance,v.,舉例,He instanced the accident as proof.,他舉出這個事故作為證明。
intense,adj.,強烈的,intense heat,強烈的熱度
intense,adj.,緊張的,an intense look,緊張的表情
interest,n.,興趣,He has no interest in music.,他對音樂沒興趣。
interest,n.,利益/關心,It's in your own interest.,這符合你自己的利益。
interest,n.,利息,The bank pays 3% interest.,銀行支付3%利息。
interpret,v.,解釋,How do you interpret this poem?,你如何解釋這首詩？
interpret,v.,口譯,He interpreted for the ambassador.,他為大使擔任口譯。
intimate,adj.,親密的,an intimate friend,一位親密的朋友
intimate,adj.,私密的,intimate details,私密的細節
intimate,v.,暗示,He intimated that something was wrong.,他暗示出了問題。
invade,v.,入侵,The army invaded the country.,軍隊入侵了那個國家。
invade,v.,侵擾,Fans invaded the star's privacy.,粉絲侵犯了明星的隱私。
iron,adj.,堅強的/嚴酷的,He has an iron will.,他有鋼鐵般的意志。
iron,n.,鐵,The gate is made of iron.,大門是鐵做的。
iron,n.,熨斗,She pressed her shirt with an iron.,她用熨斗燙襯衫。
iron,v.,熨燙,He ironed his pants.,他熨燙了他的褲子。
isolate,v.,隔離,The patient was isolated.,病人被隔離了。
isolate,v.,分離,Isolate the variable in the equation.,在方程式中分離出變數。
issue,n.,問題,The issue is complex.,這個問題很複雜。
issue,n.,期號,the latest issue of the magazine,雜誌的最新一期
issue,v.,發布,The government issued a statement.,政府發布了一份聲明。
issue,v.,發出,He issued a warning.,他發出了警告。
jam,n.,果醬,She spread jam on toast.,她在吐司上抹了果醬。
jam,n.,交通堵塞,We were stuck in a traffic jam.,我們遇上了交通堵塞。
jam,v.,塞滿/卡住,The door jammed and wouldn't open.,門卡住了打不開。
jam,v.,擠入,He jammed his clothes into the bag.,他把衣服塞進袋子裡。
jam,v.,干擾（信號）,They jammed the radio signal.,他們干擾了無線電信號。
just,adj.,公正的,He is a just man.,他是個公正的人。
just,adv.,剛剛,I just arrived.,我剛到。
just,adv.,僅僅,It's just a joke.,只是個玩笑。
key,adj.,關鍵的,He played a key role.,他扮演了關鍵角色。
key,n.,鑰匙,I lost my house key.,我弄丟了家裡的鑰匙。
key,n.,音調（音樂）,a song in the key of C,一首C調的歌。
key,v.,用鍵盤輸入,She keyed the data into the computer.,她把數據輸入電腦。
kid,n.,小孩,The kids are playing outside.,孩子們在外面玩耍。
kid,n.,小山羊,The goat fed her kids.,母山羊餵養小羊。
kid,v.,開玩笑,Don't kid me!,別跟我開玩笑！
knee,n.,膝蓋,He fell and scraped his knee.,他摔倒擦傷了膝蓋。
knee,n.,膝蓋形狀的東西,The pipe has a knee.,這根管子有一個彎頭。
knee,v.,用膝蓋頂,He kneed his attacker.,他用膝蓋頂了攻擊者。
land,n.,土地/陸地,We finally reached land.,我們終於到達了陸地。
land,v.,著陸/降落,The plane landed safely.,飛機安全著陸。
land,v.,獲得 (工作/合約),She landed a dream job.,她獲得了一份理想的工作。
last,adj.,最後的,This is my last chance.,這是我最後的機會。
last,adv.,最後地,He spoke last.,他最後發言。
last,v.,持續,The movie lasts two hours.,電影持續兩小時。
lead,n.,領先地位,He took the lead.,他取得了領先。
lead,n.,鉛（金屬）,This pencil contains lead.,這支鉛筆含有鉛。
lead,v.,帶領,She led the team to victory.,她帶領團隊取得勝利。
lead,v.,導致,Smoking can lead to cancer.,吸菸可能導致癌症。
lean,adj.,瘦的,He is tall and lean.,他高而瘦。
lean,adj.,精簡的,The company is lean and efficient.,公司精簡有效率。
lean,v.,傾斜,Lean the ladder against the wall.,把梯子靠在牆上。
lean,v.,依靠/傾向,He leans toward liberal views.,他傾向自由派觀點。
left,adj.,左邊的,Turn left at the corner.,在轉角左轉。
left,n.,左派/左邊,The left supports the policy.,左派支持這項政策。
left,v.,留下/離開（leave過去式）,He left his phone at home.,他把手機留在家裡。
leg,n.,腿,She broke her leg.,她摔斷了腿。
leg,n.,一段旅程/賽程,the last leg of the trip,旅程的最後一段。
leg,n.,家具腿,the leg of a table,桌腿。
letter,adj.,文字上的,He followed the letter of the law.,他嚴格遵守法律條文。
letter,n.,信件,I received a letter today.,我今天收到一封信。
letter,n.,字母,The word has five letters.,這個詞有五個字母。
lie,n.,謊言,That's a lie.,那是個謊言。
lie,v.,躺臥,He lies on the bed.,他躺在床上。
lie,v.,說謊,Don't lie to me.,別對我說謊。
light,adj.,輕的,This bag is very light.,這個袋子很輕。
light,adj.,明亮的,The room is light and airy.,房間明亮通風。
light,n.,光,The light is too bright.,光線太亮了。
light,v.,點燃,He lit a candle.,他點了一根蠟燭。
line,n.,線條/繩索,Draw a straight line.,畫一條直線。
line,n.,行業/領域,What is your line of work?,你從事哪一行？
line,n.,排隊/隊伍,Wait in line for the bus.,排隊等公車。
line,n.,台詞,He forgot his lines on stage.,他在台上忘了台詞。
line,v.,沿著...排成一行,Trees line the river.,樹木沿著河岸排成一列。
lock,n.,鎖,The door has a strong lock.,這扇門有一個牢固的鎖。
lock,n.,一縷頭髮,She cut off a lock of hair.,她剪下了一縷頭髮。
lock,v.,鎖上,Lock the door.,鎖上門。
lock,v.,卡住/僵住,The wheels locked.,輪子卡住了。
lot,n.,許多 (a lot of),I have a lot of work to do.,我有很多工作要做。
lot,n.,(特定用途的) 地塊,This is a parking lot.,這是一個停車場。
lot,n.,命運/份兒,It is my lot in life.,這是我的命運。
lot,n.,拍賣物品/一批,This lot was sold for $500.,這批拍賣品以 500 美元售出。
match,n.,比賽,We won the match.,我們贏了比賽。
match,n.,火柴,He struck a match.,他劃了一根火柴。
match,v.,匹配,These socks don't match.,這些襪子不配對。
matter,n.,事情/問題,It's a personal matter.,這是個人的事情。
matter,n.,物質,Solid matter occupies space.,固體物質佔有空間。
matter,v.,重要,Every vote matters.,每一票都很重要。
mean,adj.,吝嗇的,He is mean with money.,他在錢上很吝嗇。
mean,adj.,刻薄的,She said a mean thing.,她說了刻薄的話。
mean,adj.,平均的,the mean temperature,平均溫度。
mean,n.,平均數,Calculate the mean.,計算平均數。
mean,v.,意思是,What does this word mean?,這個詞是什麼意思？
mean,v.,打算,I didn't mean to hurt you.,我不是故意要傷害你。
meet,n.,運動會/集會,She won the 100m at the track meet.,她在田徑運動會上贏得了 100 公尺冠軍。
meet,v.,見面/遇見,Nice to meet you.,很高興遇見你。
meet,v.,滿足 (需求/條件),We must meet the deadline.,我們必須趕上截止日期。
mine,n.,礦場,He works in a coal mine.,他在煤礦工作。
mine,n.,地雷,The road is full of mines.,路上滿是地雷。
mine,pron.,我的,That book is mine.,那本書是我的。
mine,v.,採礦,They mine gold there.,他們在那裡開採黃金。
minute,adj.,微小的,There are minute differences.,有微小的差異。
minute,n.,分鐘,Wait a minute.,等一分鐘。
minute,n.,會議記錄（複數）,The secretary took the minutes.,秘書做了會議記錄。
Miss,n.,小姐（稱呼）,"Good morning,Miss Smith.","早安,史密斯小姐。"
miss,v.,想念,I miss you.,我想你。
miss,v.,錯過,He missed the bus.,他錯過了公車。
monitor,n.,監視器/螢幕,Check the information on the monitor.,查看顯示器上的信息。
monitor,v.,監控/監測,Scientists monitor the air quality.,科學家監控空氣品質。
mouth,n.,嘴巴,Open your mouth.,張開你的嘴巴。
mouth,n.,河口,the mouth of the river,河口。
mouth,v.,不出聲地說,He mouthed the words silently.,他無聲地用嘴型說出這些字。
nail,n.,指甲,She painted her nails.,她塗了指甲。
nail,n.,釘子,He hammered a nail into the wall.,他把釘子敲進牆裡。
nail,v.,釘住,Nail the board to the wall.,把木板釘在牆上。
nail,v.,成功完成（非正式）,He nailed the test.,他考試考得很好。
nail,v.,抓住（罪犯）,The police nailed the thief.,警察抓住了小偷。
nature,n.,大自然,We must protect the nature.,我們必須保護大自然。
nature,n.,天性/本質,It is in his nature to be kind.,善良是他的本性。
neck,n.,脖子,She wore a necklace around her neck.,她脖子上戴了項鍊。
neck,n.,瓶頸/頸部,the neck of a bottle,瓶頸。
neck,v.,摟脖子親吻（口語）,They were necking in the car.,他們在車裡摟著親熱。
nose,n.,鼻子,His nose is bleeding.,他的鼻子在流血。
nose,v.,小心翼翼地前進,The car nosed into the traffic.,汽車小心翼翼地駛入車流。
nose,v.,窺探,He nosed around the room.,他在房間裡到處窺探。
note,n.,筆記/音符/紙鈔,He took notes during the lecture.,他在講座中做筆記。
note,v.,注意/記錄,Please note that the office is closed.,請注意辦公室已關閉。
notice,n.,通知/佈告,I saw a notice on the wall.,我看到牆上有個佈告。
notice,v.,注意到,Did you notice her new haircut?,你注意到她剪新髮型了嗎？
novel,adj.,新穎的,That's a novel idea.,那是個新穎的想法。
novel,n.,小說,He wrote a novel.,他寫了一本小說。
object,n.,物體,A strange object appeared in the sky.,一個奇怪的物體出現在天空中。
object,n.,目標/目的,The object of the game is to score points.,遊戲的目標是得分。
object,v.,反對,Many people objected to the new law.,許多人反對這項新法律。
obscure,adj.,模糊的,The meaning is obscure.,意思很模糊。
obscure,adj.,不知名的,an obscure poet,一位不知名的詩人
obscure,v.,掩蓋,Fog obscured the view.,霧遮住了視野。
order,n.,順序,Put them in order.,把它們按順序排好。
order,n.,命令,The general gave an order.,將軍下了命令。
order,v.,點餐,I ordered a pizza.,我點了一份披薩。
order,v.,命令,The judge ordered silence.,法官命令肅靜。
palm,n.,手掌,He held the coin in his palm.,他把硬幣握在手掌心。
palm,n.,棕櫚樹,a palm tree,一棵棕櫚樹。
palm,v.,把…藏在手掌中,The magician palmed the card.,魔術師把牌藏在手掌中。
panel,n.,嵌板/面板,He replaced a wooden panel on the wall.,他更換了牆上的一塊木板。
panel,n.,專家小組/評審團,A panel of experts will judge the contest.,專家小組將對比賽進行評審。
panel,n.,儀表板,Check the readings on the control panel.,檢查控制面板上的讀數。
parallel,adj.,平行的,The two lines are parallel.,這兩條線是平行的。
parallel,n.,相似之處/對比,There are parallels between the two cases.,這兩個案例之間有相似之處。
parallel,v.,與...媲美/比得上,Her achievements are paralleled by few.,很少有人能比得上她的成就。
park,n.,公園,Let's go to the park.,我們去公園吧。
park,v.,停車,Where can I park my car?,我在哪裡可以停車？
park,v.,寄放/擱置,Park your bags here.,把你的包寄放在這裡。
patient,adj.,有耐心的,You need to be patient with children.,你對孩子需要有耐心。
patient,n.,病人,The doctor is seeing a patient.,醫生正在看病人。
peak,n.,山峰/頂點,The mountain peak is covered in snow.,山峰被積雪覆蓋。
peak,n.,高峰期,Traffic is heavy during peak hours.,尖峰時段交通繁忙。
peak,v.,達到巔峰,His career peaked in the 1990s.,他的職業生涯在 90 年代達到巔峰。
pen,n.,鋼筆,She writes with a pen.,她用鋼筆寫字。
pen,n.,圍欄/圈,The sheep are in the pen.,羊在圍欄裡。
pen,v.,把…關入圈中,He penned the cattle.,他把牛關進圈裡。
pen,v.,撰寫,He penned a letter.,他寫了一封信。
perspective,n.,觀點/看法,Try to see it from a different perspective.,試著從不同的角度來看。
perspective,n.,透視法,This artist uses perspective perfectly.,這位藝術家完美地運用了透視法。
pick,n.,選擇,Take your pick.,你自己選吧。
pick,n.,鋤頭,a pick and shovel,一把鎬和鏟子。
pick,v.,挑選,Pick a card.,選一張牌。
pick,v.,採摘,pick apples,摘蘋果。
pick,v.,拾起,She picked up the pen.,她撿起筆。
pick,v.,學習（非正式）,He picked up French in Paris.,他在巴黎學會了法文。
pitcher,n.,投手（棒球）,The pitcher threw a fastball.,投手投了一個快速球。
pitcher,n.,水壺/罐子,She filled the pitcher with water.,她往水壺裡裝滿水。
plant,n.,植物,I bought a new house plant.,我買了一盆新的室內植物。
plant,n.,工廠/發電廠,They work at a nuclear power plant.,他們在核能發電廠工作。
plant,v.,種植,We planted some trees in the garden.,我們在花園裡種了一些樹。
plant,v.,安置/埋伏 (監聽器或炸彈),He planted a secret microphone in the room.,他在房間裡安置了一個秘密竊聽器。
play,n.,戲劇,I saw a play on Broadway.,我在百老匯看了一齣戲。
play,n.,比賽中的動作,The rain stopped play.,下雨中斷了比賽。
play,v.,玩耍,Children play in the park.,孩子們在公園玩耍。
play,v.,演奏,He plays the piano.,他彈鋼琴。
play,v.,扮演,She played Hamlet.,她扮演哈姆雷特。
plot,n.,情節,The movie has a confusing plot.,這部電影情節混亂。
plot,n.,陰謀,They uncovered a plot.,他們發現了一個陰謀。
plot,n.,一小塊土地,He bought a plot of land.,他買了一小塊土地。
plot,v.,密謀,They plotted against the government.,他們密謀反對政府。
plot,v.,標繪,Plot the points on a graph.,在圖表上標繪出這些點。
point,n.,尖端/點,The point of a pencil.,鉛筆尖。
point,n.,重點/意義,I don't see the point of this.,我看不出這有什麼意義（重點）。
point,n.,分數/點數,They won by two points.,他們以兩分之差獲勝。
point,v.,指向/指著,Don't point your finger at me.,不要用手指指著我。
pool,n.,游泳池/水池,Let's go for a swim in the pool.,我們去游泳池游泳吧。
pool,n.,(人才/資源) 儲備庫,We have a large pool of talented applicants.,我們有大量的人才儲備。
pool,v.,集中資源/共同負擔,They pooled their savings to buy a car.,他們集資買了一輛車。
present,adj.,現在的,His present job is good.,他目前的工作不錯。
present,n.,禮物,Here is a birthday present.,這是生日禮物。
present,v.,呈現/介紹,May I present my friend?,我可以介紹我的朋友嗎？
preserve,n.,專屬領域,Hunting is a male preserve.,狩獵是男性的專屬領域。
preserve,n.,保護區,a nature preserve,自然保護區
preserve,v.,保護,We must preserve the forest.,我們必須保護森林。
preserve,v.,保存,Fish are preserved in salt.,魚用鹽醃製保存。
press,n.,新聞媒體,The press reported the story.,新聞媒體報導了這個故事。
press,n.,印刷機,The book is off the press.,這本書已下印刷機。
press,v.,按壓,Press the button.,按下按鈕。
press,v.,催促,She pressed him for an answer.,她催促他回答。
principal,adj.,主要的,The principal reason is cost.,主要原因是成本。
principal,n.,校長,The principal greeted the students.,校長向學生問好。
principal,n.,本金（金融）,You will earn interest on the principal.,你將獲得本金的利息。
produce,n.,農產品 (重音在前),You can buy fresh produce here.,你可以在這裡買到新鮮農產品。
produce,v.,生產/製造,They produce cars in this factory.,他們在這間工廠生產汽車。
project,n.,專案/計畫,We are working on a science project.,我們正在進行一個科學專案。
project,v.,投射,The image is projected onto a screen.,影像被投射到螢幕上。
project,v.,預測,The company projects a 10% growth.,公司預測10%的成長。
project,v.,展現（特質）,He projects confidence.,他展現出自信。
propose,v.,提議,I propose a new plan.,我提出一個新計劃。
propose,v.,求婚,He proposed to her last night.,他昨晚向她求婚了。
propose,v.,打算（正式）,We propose to leave at noon.,我們打算中午離開。
punch,n.,拳打,He threw a punch.,他揮了一拳。
punch,n.,打孔機,Use a punch to make a hole.,用打孔機打孔。
punch,n.,潘趣酒（飲料）,They served fruit punch.,他們供應水果潘趣酒。
punch,v.,用拳頭打,He punched the wall.,他用拳頭打牆。
punch,v.,打孔,Punch a hole in the paper.,在紙上打個洞。
race,n.,比賽,He won the 100-meter race.,他贏了100公尺賽跑。
race,n.,種族,People of all races are equal.,所有種族的人都平等。
race,v.,競速,They raced to the finish line.,他們向終點線衝刺。
race,v.,快速運轉,His heart raced with excitement.,他的心因興奮而快速跳動。
range,n.,範圍,The price range is between $10 and $20.,價格範圍在 10 到 20 美元之間。
range,n.,山脈,We hiked across the mountain range.,我們徒步穿越了那座山脈。
range,v.,(在範圍內) 變動,Temperatures range from 15 to 25 degrees.,溫度在 15 到 25 度之間波動。
record,n.,紀錄/唱片,She broke the world record.,她打破了世界紀錄。
record,n.,經歷/履歷,He has a clean driving record.,他有良好的駕駛記錄。
record,v.,記錄/錄音,The meeting was recorded.,會議被記錄/錄音下來了。
refuse,n.,垃圾/廢棄物,The truck collects refuse.,卡車收集垃圾。
refuse,v.,拒絕,She refused to answer.,她拒絕回答。
render,v.,使成為,The shock rendered him speechless.,震驚使他說不出話。
render,v.,提供,The committee will render a decision.,委員會將做出決定。
render,v.,表演,She rendered the song beautifully.,她美妙地演繹了這首歌。
reserve,n.,儲備物,oil reserves,石油儲備
reserve,n.,拘謹,He spoke with reserve.,他說話很拘謹。
reserve,v.,預訂,I reserved a table.,我預訂了一張桌子。
reserve,v.,保留,All rights reserved.,版權所有。
